{
    "blocks": {
        "addition1": {
            "algorithm": "v1/sum/1",
            "parameters": {
            },
            "inputs": {
                "a": "a",
                "b": "b"
            },
            "outputs": {
                "sum": "sum"
            }
        },
        "addition2": {
            "algorithm": "v1/sum/1",
            "parameters": {
            },
            "inputs": {
                "a": "a",
                "b": "b"
            },
            "outputs": {
                "sum": "sum"
            }
        }
    },
    "datasets": {
        "integers": {
            "database": "integers_db/1",
            "protocol": "triple",
            "set": "triple"
        }
    },
    "analyzers": {
        "analysis": {
            "algorithm": "v1/integers_analysis/1",
            "parameters": {
            },
            "inputs": {
                "input": "input"
            }
        }
    },
    "globals": {
      "environment": {
        "name": "Python for tests",
        "version": "1.3.0"
      },
      "queue": "queue"
    }
}
